A1: >> Regional Overview >> Peru Overview
A2: Activity Data Sheet PROGRAM: Peru TITLE AND NUMBER: Improved Environmental Management in Targeted Sectors, 527-004 PLANNED FY 2001 OBLIGATION AND ACCOUNT: $4,188,000 (DA) PROPOSED FY 2002 OBLIGATION AND ACCOUNT: $4,300,000 (DA) STATUS: Continuing INITIAL OBLIGATION: FY 1995 ESTIMATED COMPLETION DATE: FY 2004 Summary: Peru has an abundance of natural resources and its biodiversity is one of the richest in the world. However, Peru's environment is threatened by uncontrolled urban growth, industrial pollution, and widespread poverty that frequently lead the poor to use environmentally destructive practices to survive. Consistent with the agency's goal of protecting the environment and the Mission Performance Plan (MPP) goal of promoting sound environmental policies and sustainable use of natural resources, the purposes of USAID's environmental activities are to improve protection of the natural resource base, fragile ecosystems, and biodiversity, and to prevent or reduce urban and industrial pollution. These improvements will be achieved by: strengthening the institutional capacity of the Government of Peru (GOP) and the private sector; mobilizing public support for environmental improvements; testing and replicating innovative and sustainable technologies/practices through pilot projects; and promoting sound policies and effective legislation. All Peruvians, including the most vulnerable groups such as indigenous peoples, women and children, and those living in fragile ecosystems or peri-urban environments, are beneficiaries. The activities support the Summit of the Americas initiative to "Guarantee Sustainable Development and Conservation of the Natural Environment" through biodiversity and pollution prevention initiatives. Activities contribute to the sub-initiative of Free Trade and Cooperation in Science and Technology through a cleaner production initiative and promotion of the International Standards Organization (ISO) 14000 (environmental management) certification. The Americas Fund Agreement between the GOP and U.S. Government under the Enterprise of the Americas Initiative supports USAID objectives by financing activities designed to preserve, protect, or manage the natural and biological resources of Peru in an environmentally sound and sustainable manner, while improving child survival and development. Key Results: The cumulative number of industrial plants in targeted sectors that have adopted new cleaner production practices reached 24 in 2000. In 2000, 22 of the 80 fishmeal, cement, paper, brewery, tannery and other plants in Peru that had been exposed to USAID-sponsored pollution prevention activities, reduced their pollution levels by more than 10% by adopting more efficient production systems. For example, as a result of a small USAID grant, a plant that recycles used auto and restaurant oil greatly increased its efficiency and reduced pollution by at least 10% through the reuse of waste products such as boric acid and different gases in the refining process. At least four other businesses have eliminated or greatly reduced pollution from waste oils through the recycling activities of USAID-supported pilot projects. Preliminary data from the matrix on biodiversity and fragile ecosystem conservation and management indicates that a cumulative total of 10 biologically important natural protected areas have achieved management improvements in administration, legal status, budget, strategic planning, community participation, use of natural resources, and management of conflicts and threats. These improvements are attributable mainly to USAID-supported activities and the stable leadership at the National Institute for Natural Resources (INRENA) over the past two years. Environmental and natural resources policy or legislative reforms enacted in FY 2000 with USAID support included a forest law and draft regulations, a solid waste law, and draft regulations and laws to raise the National Environment Council (CONAM) to ministerial level and strengthen its arbitration authority. The forest law requires management plans for all forest concessions. The solid waste law establishes the universe of steps, principles, obligations, and responsibilities for the management of solid wastes in a clean and environmentally friendly way to protect the health and general wellbeing of the Peruvian populace. USAID's most recent national environmental survey shows that the percentage of Peruvians with an adequate understanding and concern for environmental and natural resource matters increased dramatically from 15% in 1998 to 30% at the beginning of FY 2000. Performance and Prospects: Activities continue to meet overall expectations, showing good prospects for achieving all expected results if requested funding is made available. USAID's Sustainable Environmental and Natural Resource Management activity (SENREM) has continued assisting CONAM to assume its role as the main GOP environmental policy-making and inter-sectoral coordination agency in Peru. SENREM is also strengthening the environmental policy and regulatory framework, promoting private sector participation, and implementing pilot interventions in biodiversity, pollution prevention, and solid waste management. Through this activity, USAID has played a key role in the development of the environmental framework legislation for the manufacturing and fisheries sectors, as well as the guidelines for the development and application of environmental review and monitoring procedures in the manufacturing sector. For a second consecutive year, the National Environmental Society, established under USAID auspices, pursued an active role in promoting private sector participation in affecting policies aimed at protecting environmental and natural resources. SENREM financed the first ever "Peru State of the Environment Report" in 2000. To date, demand for this quality document has been outstanding, further validating USAID's decision to increase and strengthen a focus on environmental education. Furthermore, the Peruvian Environmental Law Society (SPDA) has initiated a competition for six environmental and natural resource policy studies to be completed in FY 2001. SENREM also supports GOP efforts to decentralize environmental and natural resource management through the creation of 10 multi-sectoral Regional Environmental Committees. With USAID technical support, CONAM has formed inter-sectoral technical committees for developing quality standards for air, water, and noise. In addition, CONAM has established maximum permissible limits for emissions in the manufacturing, fisheries, oil, electricity, and transportation sectors. A total of 14 Peruvian firms have now received ISO 14000 certification through a SENREM activity adopted by the private sector. In FY 2001, a private sector consortium will start operating the Clean Production Center to support pollution reductions in targeted industrial areas. Testing of innovative environmental and natural resource technologies and practices through pilot projects is progressing very well. Eleven of the 35 USAID-supported pilot activities managed by SPDA are finished or are approaching completion; six of those 11 activities have validated new technologies or practices in sustained environmental management. The Biodiversity and Fragile Ecosystem Conservation and Management activity (BIOFOR) completed the ecological economic zoning analysis for the Department of Madre de Dios, one of the richest biodiversity zones in Peru. BIOFOR provided critical leadership and technical assistance for a master plan for the extremely large and biologically diverse Pacaya-Samiria National Reserve; awarded 13 grants for natural resource activities in buffer zones of six protected areas in Peru; and completed scheduled modules of a training program in institutional development for locally-based non-governmental organizations (NGOs) at each of these sites. In FY 2001 and FY 2002, BIOFOR will support INRENA, the GOP partner institution, as well as local organizations in improving the management of national parks, creating communal reserves for isolated indigenous people, developing master plans for various natural protected areas, and awarding scholarships for economic valuation of natural resources. USAID's new environmental health activity will reduce health risks associated with exposure to urban contaminants and pathogens. Implementation of the activity began with a behavior change effort in areas of Callao where a storage depot for loose ore is contributing to high blood lead levels in children. This activity also determined that much of the exposure to lead in Lima is due to dust from ore storage depots rather than lead in gasoline. The environmental health activity will implement a local grants activity and associated training in FY 2001 and FY 2002 to improve environmental health services in targeted communities and provide feedback for policies that facilitate improved urban environmental health conditions. In FY 2001, approximately $2,038,000 will be used to support pollution reduction activities, which include private sector advocacy, pilot demonstration projects, and Clean Production Center (CPC) operations. Approximately $2,000,000 will be used to support management improvements in national parks and develop a forestry management strategy for protected areas. $150,000 will finance a new Policy Deficiencies Analysis and the annual environment and resources survey. In FY 2002, approximately $2,000,000 will be assigned to support CPC operations and provide services to the GOP and private industry on pollution prevention and energy efficiency. Approximately $500,000 will be used to implement the management strategy in Pacaya Samiria National Reserve and support institutional strengthening of INRENA. Approximately $900,000 will be used to further strengthen the GOP environmental health policy-making capability and continue implementation of local grants to improve environmental health conditions. Planning is underway for the allocation of the remaining funds among new activities in environmental education, policy development, and institution building, which are still in the planning stages. Possible Adjustments to Plans: A major evaluation of all environmental management activities completed in June 2000 served as the basis for developing a new five-year strategic plan that will begin in FY 2002. Contingent upon availability of funds, USAID plans to extend the ongoing SENREM and BIOFOR activities through 2003 and develop two new activities: an environmental education and awareness activity for implementation in 2002; and an environmental policy development and national and local institution building activity for implementation in 2003. Other Donor Programs: The World Bank and Japan's International Cooperation Agency provide support to rehabilitate Lima's water and sewage systems, while the Inter-American Development Bank supports basic sanitation services in 36 cities. The Swiss provide environmental monitoring support to the Ministry of Industry, which augments USAID's institutional strengthening activity, and is assisting USAID in developing a clean production center. A small United Nations Development Program activity is assisting CONAM to organize Regional Environmental Committees. USAID collaborates closely in biodiversity conservation with bilateral donors including the Netherlands, Germany, Canada, Finland, and Switzerland. The World Bank supports the protected areas fiduciary fund. The Food and Agricultural Organization is helping to develop a National Forestry Development Strategy and support forest management and re-forestation in the highlands. A donor coordination mechanism created by BIOFOR has assumed a broad role across most environmental issues and is currently the only broad-based donor environmental coordination mechanism functioning in Peru. Principal Contractors, Grantees or Agencies: Principal contractors are the U.S. firms Abt Associates; International Resources Group; and Camp, Dresser and McKee. Local partners include the Environmental Law Society and GOP counterpart agencies CONAM, INRENA, and the General Directorate for Environmental Health within the Ministry of Health. FY 2002 Performance Table Peru: 527-004 Performance Measures: Indicator Information: U.S. Financing (In thousands of dollars)

A1: Indicator | B1: FY97(Actual) | C1: FY98(Actual) | D1: FY99(Actual) | E1: FY00(Actual) | F1: FY00(Plan) | G1: FY01(Plan) | H1: FY02(Plan)
A2: Indicator 1: Number of targeted ENR policy and legislation overlaps, inconsistencies, or gaps eliminated. | B2: 3 | C2: 3 | D2: 3 | E2: 3 | F2: 3 | G2: 95 | H2: 95
A3: Indicator 2: Number of industrial plants in targeted sectors that have adopted new pollution prevention/cleaner production practices | B3: 0 | C3: 2 | D3: 22 | E3: 24 | F3: 24 | G3: 45 | H3: 60
A4: Indicator 3: Environmental technologies tested and validated through pilot projects. | B4: 1 | C4: 1 | D4: NA | E4: 6 | F4: 5 | G4: 6 | H4: 5
A5: Indicator 4: Number of biologically-important national parks that have achieved management improvements | B5: 0 | C5: 5 | D5: 8 | E5: 10 | F5: 3 | G5: 5 | H5: 7

A1: Indicator | B1: Level (S)or(IR) | C1: Unit of Measure | D1: Source | E1: Indicator Description
A2: Indicator 1: | B2: IR | C2: Annual Number | D2: CONAM MIS | E2: Number of ENR policies and legislation approved, which are directed to address 30 pre-selected overlaps, inconsistencies, or gaps, identified in year one by USAID and qualified by a panel of experts. Gaps were identified by a local expert from the Peruvian Society of Environmental Law (SPDA) in 1996.
A3: Indicator 2: | B3: SO | C3: Cumulative Number | D3: CONAM records | E3: Number of plants in targeted sectors that have reduced or prevented pollution by 10% or more. Plants in targeted sectors are those that have accessed pollution prevention/clean production (P2/CP) promotion activities (e.g., information, training, technical advice, P2 audits, technology transfers, etc.). P2/CP practices are those which (a) reduce the amount of any hazardous substance, pollutant or contaminant entering any waste stream or being released into the environment prior to recycling, treatment or disposal; (b) replace toxic chemicals with less harmful chemicals; and/or (c) reduce the usage of materials (water, natural resources, energy).
A4: Indicator 3: | B4: IR | C4: Annual number | D4: USAID sustainable environment and natural resources MIS | E4: Innovative, feasible for wide spread adoption and economically viable environmental technologies/practices developed and validated, through the attainment of the intended results. Each new technology is analyzed to make sure that it is tested properly and validated.
A5: Indicator 4: | B5: SO | C5: Cumulative Number of Parks | D5: Performance Management Matrix updated by a private firm under USAID guidance | E5: Improvements are management threshold level advances, which reflect increases in performance capacity and use of human, technical and financial resources directed towards the conservation of select national parks and reserves. Threshold levels are: not acceptable, deficient, acceptable with reservations, good and excellent. They are based on the status of the following areas: legal status, administration, budget, strategic planning, level of community participation, use of natural resources, and management of conflicts and threats. Parks considered are: Tingo Marfa, Manu, Huascaran, Cerros de Amotape, Rio Abiseo, Yanachaga-Chemillen, Bahuaja-Sonene, Junfn, Paracas, Titicaca, Salinas y Aguada Blanca, Pacaya-Samiria, Calipuy, Manglares de Tumbes, MacchuPichu.

B1: Obligations | D1: Expenditures | F1: Unliquidated
A2: Through September 30, 1999 | B2: 13,464 | C2: DA | D2: 7,228 | E2: DA | F2: =SUM(B2-D2) -> 6,236 | G2: DA
B3: 1,106 | C3: CSD | D3: 233 | E3: CSD | F3: =SUM(B3-D3) -> 873 | G3: CSD
B4: 0 | C4: ESF | D4: 0 | E4: ESF | F4: =SUM(B4-D4) -> 0 | G4: ESF
B5: 0 | C5: SEED | D5: 0 | E5: SEED | F5: =SUM(B5-D5) -> 0 | G5: SEED
B6: 0 | C6: FSA | D6: 0 | E6: FSA | F6: =SUM(B6-D6) -> 0 | G6: FSA
B7: 0 | C7: DFA | D7: 0 | E7: DFA | F7: =SUM(B7-D7) -> 0 | G7: DFA
A8: Fiscal Year 2000 | B8: 4,104 | C8: DA | D8: 3,259 | E8: DA
B9: 0 | C9: CSD | D9: 273 | E9: CSD
B10: 0 | C10: ESF | D10: 0 | E10: ESF
B11: 0 | C11: SEED | D11: 0 | E11: SEED
B12: 0 | C12: FSA | D12: 0 | E12: FSA
B13: 0 | C13: DFA | D13: 0 | E13: DFA
A14: Through September 30, 2000 | B14: =SUM(B2+B8) -> 17,568 | C14: DA | D14: =SUM(D2+D8) -> 10,487 | E14: DA | F14: =SUM(B14-D14) -> 7,081 | G14: DA
B15: =SUM(B3+B9) -> 1,106 | C15: CSD | D15: =SUM(D3+D9) -> 506 | E15: CSD | F15: =SUM(B15-D15) -> 600 | G15: CSD
B16: =SUM(B4+B10) -> 0 | C16: ESF | D16: =SUM(D4+D10) -> 0 | E16: ESF | F16: =SUM(B16-D16) -> 0 | G16: ESF
B17: =SUM(B5+B11) -> 0 | C17: SEED | D17: =SUM(D5+D11) -> 0 | E17: SEED | F17: =SUM(B17-D17) -> 0 | G17: SEED
B18: =SUM(B6+B12) -> 0 | C18: FSA | D18: =SUM(D6+D12) -> 0 | E18: FSA | F18: =SUM(B18-D18) -> 0 | G18: FSA
B19: =SUM(B7+B13) -> 0 | C19: DFA | D19: =SUM(D7+D13) -> 0 | E19: DFA | F19: =SUM(B19-D19) -> 0 | G19: DFA
A20: Prior Year Unobligated Funds | B20: 0 | C20: DA
B21: 0 | C21: CSD
B22: 0 | C22: ESF
B23: 0 | C23: SEED
B24: 0 | C24: FSA
B25: 0 | C25: DFA
A26: Planned Fiscal Year 2001 NOA | B26: 4,188 | C26: DA
B27: 0 | C27: CSD
B28: 0 | C28: ESF
B29: 0 | C29: SEED
B30: 0 | C30: FSA
B31: 0 | C31: DFA
A32: Total Planned Fiscal Year 2001 | B32: =SUM(B20+B26) -> 4,188 | C32: DA
B33: =SUM(B21+B27) -> 0 | C33: CSD
B34: =SUM(B22+B28) -> 0 | C34: ESF
B35: =SUM(B23+B29) -> 0 | C35: SEED
B36: =SUM(B24+B30) -> 0 | C36: FSA
B37: =SUM(B25+B31) -> 0 | C37: DFA
D38: Future Obligations | F38: Est. Total Cost
A39: Proposed Fiscal Year 2002 NOA | B39: 4,300 | C39: DA | D39: 3,656 | E39: DA | F39: =+B14+B32+B39+D39 -> 29,712 | G39: DA
B40: 0 | C40: CSD | D40: 0 | E40: CSD | F40: 1,106 | G40: CSD
B41: 0 | C41: ESF | D41: 0 | E41: ESF | F41: =SUM(B16+B34+B41+D41) -> 0 | G41: ESF
B42: 0 | C42: SEED | D42: 0 | E42: SEED | F42: =SUM(B17+B35+B42+D42) -> 0 | G42: SEED
B43: 0 | C43: FSA | D43: 0 | E43: FSA | F43: =SUM(B18+B36+B43+D43) -> 0 | G43: FSA
B44: 0 | C44: DFA | D44: 0 | E44: DFA | F44: =SUM(B19+B37+B44+D44) -> 0 | G44: DFA

A2: Last Updated on: May 29, 2002

A1: : : : : : : : : : : | C1: What's New : FOIA Requests : Privacy Policy : Email This Page : Plug-ins : FAQs : Help Desk : Contact Us : Site Map