Sheet: Tabelle1
A1: Stundenplanung
B2: Day
A3: Person | B3: 1 | C3: 2 | D3: 3 | E3: 4 | F3: 5 | G3: 6 | H3: 7 | J3: Sum
A4: Albert | B4: 4 | C4: 5 | D4: 4 | E4: 5 | F4: 6 | G4: 7 | H4: 0 | J4: =SUM(RC[-8]:RC[-2]) -> 31
A5: Benedict | B5: 3 | C5: 3 | D5: 6 | E5: 7 | F5: 0 | G5: 8 | H5: 0 | J5: =SUM(RC[-8]:RC[-2]) -> 27
A6: Chris | B6: 2 | C6: 6 | D6: 7 | E6: 9 | F6: 9 | G6: 0 | H6: 9 | J6: =SUM(RC[-8]:RC[-2]) -> 42
A7: Detlef | B7: 1 | C7: 8 | D7: 3 | E7: 5 | F7: 7 | G7: 8 | H7: 0 | J7: =SUM(RC[-8]:RC[-2]) -> 32
A9: Sum | B9: =SUM(R[-5]C:R[-2]C) -> 10 | C9: =SUM(R[-5]C:R[-2]C) -> 22 | D9: =SUM(R[-5]C:R[-2]C) -> 20 | E9: =SUM(R[-5]C:R[-2]C) -> 26 | F9: =SUM(R[-5]C:R[-2]C) -> 22 | G9: =SUM(R[-5]C:R[-2]C) -> 23 | H9: =SUM(R[-5]C:R[-2]C) -> 9 | J9: =SUM(R[-5]C:R[-2]C) - SUM(RC[-8]:RC[-2]) -> 0